company,description,website,region,year-selected,vertical,sub-vertical,entrepreneurs,fund,financing-round,status,year-invested
Pantys,Pantys is an omni-channel DNVB that is transforming feminine care to deliver best-in-class innovations in women’s health and sustainability.,https://www.pantys.com.br/,Latin America,2021,Retail & Consumer Tech,Wellness & Beauty,[],,,,
Papadimitriou,"Papadimitriou is a family-owned commodity export business of all-natural balsamic vinegars and mustards in unique Mediterranean flavors, all derived from currants.",http://www.papadim.com,Europe,2013,Food & Beverage,CPG & Consumer Products,"['{""name"": ""Christos Papadimitriou"", ""url"": """"}']",,,,
Parclick,Parclick offers consumers online parking reservations in Europe. It provides guaranteed reservations of parking spaces in covered and guarded public car parks at discounted prices.,https://parclick.com/,Europe,2015,Smart City,Mobility,"['{""name"": ""Ivan Rodriguez"", ""url"": ""https://www.linkedin.com/in/ivanrodriguez/""}', '{""name"": ""Luis Paris"", ""url"": ""https://www.linkedin.com/in/luisparisc/""}']",,,,
Pargo,"Pargo is a South African smart logistics company that connects consumers, companies, and couriers nationwide, allowing them to send and receive parcels through a tech enabled network of Pargo pick-up points located at convenient retail stores.",http://www.pargo.co.za,Africa,2018,Enterprise Software & Services,Business Services & Consulting,"['{""name"": ""Derk Hoekert"", ""url"": ""https://www.linkedin.com/in/hoekert/""}', '{""name"": ""Lars Veul"", ""url"": ""https://www.linkedin.com/in/lars-veul-4987184b/""}']",,,,
Parkimovil,"Parkimovil allows for the efficient control of parking lots, generating mobility solutions in overpopulated areas throughout Mexico. It is an app-based system that provides virtual parking and access control, and enables interactions and payments.",http://www.parkimovil.com,Latin America,2013,Smart City,Mobility,"['{""name"": ""Carlos Anaya Rodriguez"", ""url"": ""https://www.linkedin.com/in/carlosanayardz/""}']",,,,
Passei Direto,Passei Direto is Brazil’s largest study platform that allows students to access millions of study materials on a freemium subscription model. The company sold to UOL Edtech in 2021.,https://www.passeidireto.com/,Latin America,2018,Education & Talent,Higher Education,"['{""name"": ""Rodrigo Salvador"", ""url"": ""https://www.linkedin.com/in/salvadorrodrigo/""}', '{""name"": ""Andre Simoes"", ""url"": ""https://www.linkedin.com/in/pd-andre/""}']",Fund III,Series B,Status: Exit,Invested: 2020
Patagonia Biotecnología,Patagonia Biotecnología (“PatBio”) uses abundant seaweed to produce bio-stimulants that enhance growth and increase yields and caliber of a wide range of agricultural products.,http://www.fartum.cl,Latin America,2015,Agriculture,Agricultural Sciences,"['{""name"": ""Rebeca Galvez"", ""url"": ""https://www.linkedin.com/in/rebeca-galvez-7761ba97/""}']",,,,
Paytabs,PayTabs is an online payment gateway operating in the MENA and Asia-Pacific regions.,https://www.paytabs.com/en/,Middle East,2017,Fintech,Payments,"['{""name"": ""Abdulaziz AlJouf"", ""url"": ""https://www.linkedin.com/in/abdulaziz-aljouf""}']",,,,
PedidosYa,"PedidosYa connects consumers with restaurants and groceries stores for easy and quick delivery and take-away via online ordering, phone and interactive TV. Pedidos Ya was acquired by Delivery Hero in 2014.",https://www.pedidosya.com,Latin America,2011,Retail & Consumer Tech,Grocery & Delivery,"['{""name"": ""\\u00c1lvaro Garc\\u00eda"", ""url"": ""https://www.linkedin.com/in/alvarogarcia17/""}', '{""name"": ""Ariel Burschtin"", ""url"": ""https://www.linkedin.com/in/aburschtin/""}', '{""name"": ""Ruben Sosenke"", ""url"": ""https://www.linkedin.com/in/rsosenke/""}']",,,,
Pharma M,Pharma M is a pharmaceutical manufacturing company specializing in the production and marketing of clinically proven dietary supplements.,http://pharmam.com/,Middle East,2016,Healthcare,Consumer Health and Wellness,"['{""name"": ""Marwan Malek"", ""url"": ""https://www.linkedin.com/in/marwan-malek-84b87b1a/""}']",,,,
Photobook,"Photobook Worldwide is an e-commerce business that provides a unique experience in preserving meaningful memories through a fully customizable, premium printed photo album.",http://www.photobook.com.my/,Asia,2018,Retail & Consumer Tech,Household & Office,"['{""name"": ""Wee Jonn Leow"", ""url"": ""https://www.linkedin.com/in/wee-jonn-leow-2001b0b/ Mark Koay https://www.linkedin.com/in/mkoay/""}']",,,,
Picus Security,Picus Security is a cybersecurity platform operating in the Breach & Attack Simulation (BAS) subsector of cyber tools.,https://www.picussecurity.com/,Europe,2018,Enterprise Software & Services,Security,"['{""name"": ""Volkan Erturk"", ""url"": ""https://www.linkedin.com/in/volkanerturk/""}', '{""name"": ""Alper Memis"", ""url"": ""https://www.linkedin.com/in/hamdi-alper-memis-cfa-1503a3a/""}']",Fund III,Series A,Status: Active,Invested: 2019
Pier,"Pier is a Brazilian insurtech platform that provides smartphone and automobile coverage to its 100k+ customers. Founded in 2018, the company offers smartphone and automobile insurance products and is the first and only insurtech in the country to operate under the Oficial Brazilian Regulator permanent national insurance license.",http://pier.digital,Latin America,2022,Fintech,Insurtech,"['{""name"": ""Igor Mascarenhas"", ""url"": ""https://www.linkedin.com/in/igormmascarenhas""}', '{""name"": ""Lucas Prado"", ""url"": ""https://www.linkedin.com/in/lucas-prado-2703a733/""}', '{""name"": ""Rafael Oliveira"", ""url"": ""https://www.linkedin.com/in/rafaelcgo""}']",,,,
PINCHO,Pincho Factory’s Latin-inspired burgers and “pincho” -the Spanish word for a kebab- offer a fast-casual dining experience as diversely American as the city that calls it home.,http://pincho.com,U.S. & Canada,2016,Food & Beverage,Food Service,"['{""name"": ""Otto Othman"", ""url"": ""https://www.linkedin.com/in/otto-othman/""}']",,,,
Pipefy,"Pipefy optimizes business processes one workflow at a time, empowering every “doer” to organize and control their work in a single place, streamline and automate any process, and integrate with legacy tools without a single line of code.",https://www.pipefy.com/pt-br/,Latin America,2018,Enterprise Software & Services,Business Process Management,"['{""name"": ""Alessio Alion\\u00e7o"", ""url"": ""https://www.linkedin.com/in/alessioalionco/""}']",Fund III,Series B,Status: Active,Invested: 2019
Pisamonas,Pisamonas is a Spanish kids’ footwear brand that combines great design and affordable prices.,https://www.pisamonas.es/,Europe,2018,Retail & Consumer Tech,Fashion & Apparel,"['{""name"": ""Enrique Bretos"", ""url"": ""https://www.linkedin.com/in/enrique-bretos-6ab856110/""}']",,,,
Pitzi,"Pitzi offers customers a phone protection plan against accidents and/or theft that guarantees a phone back in less than 5 days, or a new one if Pitzi can’t repair the damages.",https://pitzi.com.br/,Latin America,2017,Fintech,Insurance,"['{""name"": ""Daniel Hatkoff"", ""url"": ""https://www.linkedin.com/in/dhatkoff""}']",,,,
Planet Farms,"Planet Farms built and operates the largest vertical farm in Europe, on the outskirts of Milan, producing and packaging basil and lettuce sold in 350+ supermarket chains and online retailers across Italy.",https://www.planetfarms.ag/en,Europe,2022,Agriculture,Produce & Commodities,"['{""name"": ""Luca Travaglini"", ""url"": ""https://www.linkedin.com/in/luca-travaglini-8440872/""}', '{""name"": ""Daniele Benatoff"", ""url"": ""https://www.linkedin.com/in/daniele-benatoff/""}']",,,,
Platinum Heritage,"Platinum Heritage is a tourism company, showcasing the true roots of Emirati and Bedouin cultures.",https://www.platinum-heritage.com,Middle East,2017,Retail & Consumer Tech,Tourism & Hospitality,"['{""name"": ""Adam McEwan"", ""url"": ""https://www.linkedin.com/in/adam-mcewan-99a270b/""}']",,,,
Plaza Logistica,"Plaza Logística enables large retail, e-commerce and other businesses to create synergies across their logistics operations, from warehouse loading and unloading to security systems, helping them reduce costs.",https://www.plazalogistica.com.ar/,Latin America,2019,Smart City,Logistics Tech,[],,,,
