company,description,website,region,year-selected,vertical,sub-vertical,entrepreneurs,fund,financing-round,status,year-invested
SkyPatrol,"SkyPatrol creates GPS and cellular-enabled solutions for tracking and optimizing vehicle activities. Its integrated hardware and location-based software solutions are tailored to vehicular financiers, fleet managers, car dealerships, auto rental companies seeking to reduce risk, lower cost, and increase the accountability of their mobile assets.",http://www.skypatrol.com,U.S. & Canada,2015,Enterprise Software & Services,Business Process Management,"['{""name"": ""Robert Rubin"", ""url"": ""https://www.linkedin.com/in/robert-rubin-8774283/""}']",,,,
SkySpecs,"SkySpecs automates the time-consuming and dangerous inspection, diagnostics, and maintenance of utility-scale wind turbines through the use of an automated drone inspection service and analytics platform that allows for repeatability, high-quality data, and safer inspections.",https://skyspecs.com/,U.S. & Canada,2017,Smart City,Constructech,"['{""name"": ""Tom Brady"", ""url"": ""https://www.linkedin.com/in/tombrady89/""}', '{""name"": ""Danny Ellis"", ""url"": ""https://www.linkedin.com/in/dannyellis1/""}']",Fund II,Series B,Status: Active,Invested: 2017
Smart Medical Services,Smart Medical Services offers corporate clients customized and discounted health care plans.,http://www.smart-medicalservices.com,Middle East,2013,Healthcare,Insurtech,"['{""name"": ""Amr El-Tayeb"", ""url"": ""https://www.linkedin.com/in/amr-el-tayeb-2475171/""}']",,,,
Smartick,"Smartick is an online learning program that helps children reach their potential by using mathematics to increase mental agility, calculation skills, concentration, and studying methods.",http://www.smartickmethod.com,Europe,2015,Education & Talent,K-12,"['{""name"": ""Javier Arroyo"", ""url"": ""https://www.linkedin.com/in/javierarroyo/""}', '{""name"": ""Daniel Gonz\\u00e1lez de Vega"", ""url"": ""https://www.linkedin.com/in/ddevega/""}']",,,,
SmartMessage,"SmartMessage is an omni-channel digital marketing software company that helps enterprise clients to schedule, launch, and analyze omnichannel marketing campaigns from a single centralized platform.",https://www.smartmessage.com/,Europe,2017,Enterprise Software & Services,AdTech & MarTech,"['{""name"": ""O\\u011fuz K\\u00fc\\u00e7\\u00fckbarak"", ""url"": ""https://www.linkedin.com/in/oguz-kucukbarak/?originalSubdomain=tr""}']",Fund II,Series B,Status: Active,Invested: 2019
Snapcart,"Snapcart applies AI to build an offline database of users in emerging markets, enabling brands like P&G, Unilever and Danone to engage shoppers in real-time.",https://snapcart.asia/,Asia,2016,Enterprise Software & Services,Customer Relationship Management,[],,,,
Softec International,Softec International provides end-to-end visibility and command & control solutions for commercial fleets.,http://softectechnologies.com,Middle East,2016,Smart City,Mobility,"['{""name"": ""Nour Shawky"", ""url"": ""https://www.linkedin.com/in/nourshawky/""}']",,,,
SoftGroup,SoftGroup provides an end-to-end mass serialization solution for pharmaceutical manufacturers and distributors of all sizes.,http://www.softgroup.eu/,Europe,2016,Healthcare,Enterprise Medical Software and Services,"['{""name"": ""Venelin Dimitrov"", ""url"": ""https://www.linkedin.com/in/venelindimitrov/""}']",,,,
Softomotive,Softomotive provides Robotic Process Automation (RPA) products and services. The company was acquired by Microsoft in 2020.,https://www.softomotive.com,Europe,2019,Enterprise Software & Services,Business Process Management,"['{""name"": ""Argyris Kaninis"", ""url"": ""https://www.linkedin.com/in/akaninis/?originalSubdomain=gr""}', '{""name"": ""Marios Stavropoulos"", ""url"": ""https://www.linkedin.com/in/marios-stavropoulos-8b3a3423/?originalSubdomain=gr""}']",,,,
Softruck,"Softruck develops mobile fleet monitoring solutions across South America, focusing on real-time visibility using AI-enabled software.",https://www.softruck.com,Latin America,2019,Smart City,Logistics Tech,"['{""name"": ""Marcelo Lapi Cruz"", ""url"": ""https://www.linkedin.com/in/marcelo-lapi-cruz-6b16b150/""}', '{""name"": ""Andre Bueno"", ""url"": ""https://www.linkedin.com/in/andre-soares-bueno/""}', '{""name"": ""Catalina Prevett Vera"", ""url"": ""https://www.linkedin.com/in/catalina-prevett/""}']",,,,
SolarizEgypt,"SolarizEgypt finances, designs, installs, and commissions PV solar power plants for commercial, industrial, and residential electricity consumers.",http://www.solarizegypt.com,Middle East,2016,Smart City,Energy,"['{""name"": ""Yaseen Abdel-Ghaffar"", ""url"": ""https://www.linkedin.com/in/rana-alaa-647b8a110/?originalSubdomain=eg""}']",,,,
Solinftec,"Solinftec has developed a set of tech-solutions, including proprietary hardware, telemetry communications, and a SaaS platform, that help farmers track and monitor the progress of their operations.",http://www.solinftec.com,Latin America,2019,Agriculture,AgTech & Data,"['{""name"": ""Britaldo Hernandez"", ""url"": ""https://www.linkedin.com/in/britaldo-hernandez-00577815a/""}', '{""name"": ""Anselmo Del Toro Arce"", ""url"": ""https://www.linkedin.com/in/anselmo-del-toro-arce-5a842793/""}', '{""name"": ""Rodrigo Iafelice dos Santos"", ""url"": ""https://www.linkedin.com/in/rodrigoiafelicedossantos/""}']",,,,
SoLo Funds,SoLo Funds is a peer-to-peer lending marketplace for micro loans.,https://www.solofunds.com/,,2020,Fintech,Lending,"['{""name"": ""Travis Holoway"", ""url"": ""https://www.linkedin.com/in/travis-holoway-62954531/""}']",Fund III,Series A,Status: Active,
Solubio,"Solubio provides on-farm biological management for farmers, enabling them to produce their own biological pesticides on site and reduce costs.",http://www.solubio.agr.br,Latin America,2020,Agriculture,Agricultural Sciences,"['{""name"": ""Alber Guedes"", ""url"": ""https://www.linkedin.com/in/alber-m-guedes-2b26a51a2/""}', '{""name"": ""Maur\\u00edcio Schneider"", ""url"": ""https://www.linkedin.com/in/mauricioschneider/""}']",,,,
SOS Asistencia,"SOS Asistencia offers assistance services for home insurance providers, retailers, businesses, and individuals.",https://www.sosasistencia.com/,Latin America,2018,Retail & Consumer Tech,Services & Task Platforms,"['{""name"": ""Tatiana Arcila"", ""url"": ""https://www.linkedin.com/in/tatiana-arcila-escobar-48b00340/""}', '{""name"": ""Andres Arcila"", ""url"": ""https://www.linkedin.com/in/andr%C3%A9s-arcila-escobar-a442a0b9/""}', '{""name"": ""Esteban Arcila"", ""url"": ""https://www.linkedin.com/in/esteban-arcila-escobar-103367135/""}']",,,,
SosTariffe,"SosTariffe is a price comparison website in Italy across 12 service categories including broadband, utilities and insurance. The company was acquired by Mutuionline in 2020.",https://www.sostariffe.it/,Europe,2019,Enterprise Software & Services,AdTech & MarTech,"['{""name"": ""Giuliano Messina"", ""url"": ""https://www.linkedin.com/in/giulianomessina/""}', '{""name"": ""Alberto Mazzetti"", ""url"": ""https://www.linkedin.com/in/albertomazzetti/""}']",,,,
Soundreef,Soundreef is the first private European company that collects and distributes music royalties on behalf of artists and publishers.,http://www.soundreef.com/en/,Europe,2017,Retail & Consumer Tech,Media & Entertainment,"['{""name"": ""Davide d\'Atri"", ""url"": ""https://www.linkedin.com/in/davidedatri/""}']",,,,
Souqalmal,"Souqalmal is a financial comparison site, enabling consumers to compare credit cards, personal loans, insurance plans, mortgages, mobile phone plans, and car loans.",https://www.souqalmal.com,Middle East,2016,Smart City,Insurance,"['{""name"": ""Ambareen Musa"", ""url"": ""http://www.linkedin.com/pub/ambareen-musa/1/a53/453""}']",Fund II,Series B,Status: Active,Invested: 2017
SPARK Schools,"SPARK Schools provides transformational education innovation through a blended learning model, which elevates student achievement and provides the tools teachers need to serve their students effectively.",http://www.sparkschools.co.za,Africa,2016,Education & Talent,K-12,"['{""name"": ""Stacey Brewer"", ""url"": ""https://www.linkedin.com/in/staceydianebrewer/""}']",,,,
Spira,Grupo Spira is a professional services firm offering tailored employee training programs focused on performance improvement rather than knowledge acquisition.,http://www.grupospira.com/,Latin America,2016,Education & Talent,Workforce,"['{""name"": ""Juan Carlos Paris"", ""url"": ""https://www.linkedin.com/in/juancarlosparis/""}']",,,,
