company,description,website,region,year-selected,vertical,sub-vertical,entrepreneurs,fund,financing-round,status,year-invested
Zenvia,"Zenvia is a Communications Platform as a Service (CPaaS) platform, offering APIs that simplify the integration of communication capabilities into apps, services, or processes and enable companies to manage communications across channels. The company went public on the NASDAQ in July 2021.",http://www.zenvia.com.br,Latin America,2020,Enterprise Software & Services,Cloud Communications,"['{""name"": ""Cassio Bobsin"", ""url"": ""https://www.linkedin.com/in/cassiobobsin/""}']",,,,
Zid,Zid is a SaaS-based “e-commerce in a box solution” that enables retailers to easily build and manage an online store presence.,https://zid.sa/en/,Middle East,2021,Enterprise Software & Services,eCommerce & Retail Management,"['{""name"": ""Mazen Al Darrab"", ""url"": ""https://www.linkedin.com/in/mdarrab/""}', '{""name"": ""Sultan Al Asmi"", ""url"": ""https://www.linkedin.com/in/sultan-h-alasmi-3bb50331/""}']",,,,
Zippedi Inc.,"Zippedi digitizes brick and mortar stores using a RaaS (Robotics as a Service) model. It enables retailers, CPGs, and service providers to leverage digital insights to solve key, costly industry challenges, including out-of-stock inventory and last-mile delivery.",http://www.zippedi.com/,Latin America,2018,Enterprise Software & Services,eCommerce & Retail Management,"['{""name"": ""Luis Vera"", ""url"": ""https://www.linkedin.com/in/luis-vera-1876791/""}']",Fund III,Series A,Status: Active,Invested: 2022
Zolvers,"Zolvers is an online marketplace for domestic worker and handyman referrals, connecting clients to pre-screened service professionals in major cities.",https://zolvers.com/,Latin America,2016,Retail & Consumer Tech,Services & Task Platforms,"['{""name"": ""Cecilia Retegui"", ""url"": ""https://www.linkedin.com/in/ceciliaretegui/""}']",,,,
Zooba,Zooba offers authentic Egyptian fast food cuisine.,http://www.zoobaeats.com/,Middle East,2014,Food & Beverage,Food Service,"['{""name"": ""Chris Khalifa"", ""url"": ""https://www.linkedin.com/in/christopher-khalifa-a40031a/""}']",,,,
ZUP,"Zup is a software engineering company that enables partners’ growth by offering large database analysis as a service. This includes digital strategy consulting, agile development, as well as growth hacking support. The company was acquired by Itau bank in 2019.",https://zup.com.br/,Latin America,2015,Enterprise Software & Services,Cloud Infrastructure & IT,"['{""name"": ""Bruno Pierobon"", ""url"": ""https://www.linkedin.com/in/brunopierobonzup?originalSubdomain=brGustavo""}', '{""name"": ""Gustavo Henrique Cunha Debs"", ""url"": ""https://www.linkedin.com/in/gustavodebs""}', '{""name"": ""Flavio Henrique Zago"", ""url"": ""https://www.linkedin.com/in/fl%C3%A1viozago/?originalSubdomain=brFelipe""}', '{""name"": ""Felipe Almeida"", ""url"": ""https://www.linkedin.com/in/felipealmeidazup/?originalSubdomain=br""}']",,,,
